{
  "$schema": "https://json-schema.org/draft/2020-12/schema",
  "$id": "https://schemas.ecp-protocol.org/0.1.0/manifest.schema.json",
  "title": "ECP Manifest",
  "description": "Deterministic artifact-set manifest. Entries are ordered by path (ascending). manifest_hash = SHA-256 over the ECP-CANONICAL-JSON-1.0 serialization of this document with the top-level manifest_hash field removed. Artifact hashes are SHA-256 over raw file bytes. Path uniqueness within a manifest is required and enforced by the builder and the verification layer (not expressible in vanilla JSON Schema).",
  "type": "object",
  "required": [
    "ecp_object",
    "manifest_type",
    "protocol_version",
    "schema_version",
    "canonicalization",
    "hash_algorithm",
    "generated_at",
    "entries",
    "manifest_hash"
  ],
  "properties": {
    "ecp_object": { "const": "manifest" },
    "manifest_type": {
      "enum": ["artifact-set", "evidence-bundle", "repository"]
    },
    "protocol_version": { "$ref": "#/$defs/semver" },
    "schema_version": { "$ref": "#/$defs/semver" },
    "canonicalization": { "const": "ECP-CANONICAL-JSON-1.0" },
    "hash_algorithm": { "const": "sha256" },
    "generated_at": {
      "$ref": "#/$defs/iso8601_utc",
      "description": "UTC timestamp. Deterministic manifest regeneration pins this value; otherwise it varies and so does manifest_hash (by design)."
    },
    "entries": {
      "type": "array",
      "minItems": 1,
      "items": {
        "type": "object",
        "required": ["role", "path", "algorithm", "hash"],
        "properties": {
          "role": { "type": "string", "minLength": 1 },
          "path": {
            "type": "string",
            "minLength": 1,
            "description": "Repository-root-relative (or bundle-root-relative, declared by the owning document) path of the artifact."
          },
          "algorithm": { "const": "sha256" },
          "hash": { "$ref": "#/$defs/sha256_hex" }
        },
        "additionalProperties": false
      }
    },
    "manifest_hash": {
      "$ref": "#/$defs/sha256_hex",
      "description": "SHA-256 over the canonical serialization of this document minus the manifest_hash field."
    },
    "note": {
      "type": "string",
      "description": "Optional commentary (covered by manifest_hash)."
    }
  },
  "additionalProperties": false,
  "$defs": {
    "semver": {
      "type": "string",
      "pattern": "^(0|[1-9]\\d*)\\.(0|[1-9]\\d*)\\.(0|[1-9]\\d*)(?:-((?:0|[1-9]\\d*|\\d*[a-zA-Z-][0-9a-zA-Z-]*)(?:\\.(?:0|[1-9]\\d*|\\d*[a-zA-Z-][0-9a-zA-Z-]*))*))?(?:\\+([0-9a-zA-Z-]+(?:\\.[0-9a-zA-Z-]+)*))?$"
    },
    "sha256_hex": {
      "type": "string",
      "pattern": "^[0-9a-f]{64}$"
    },
    "iso8601_utc": {
      "type": "string",
      "pattern": "^\\d{4}-\\d{2}-\\d{2}T\\d{2}:\\d{2}:\\d{2}(\\.\\d+)?Z$"
    }
  }
}
